{
  "schema_version": 1,
  "record_type": "evidence",
  "evidence_id": "evidence_schema_validation_001",
  "subject_id": "asset_synthetic_video_001",
  "evidence_kind": "schema_validation",
  "recorded_at": "2026-01-01T00:00:00Z",
  "summary": "Synthetic schema validation completed.",
  "public_references": [
    "https://njpvideo.ggcf.kr/synthetic/item-001"
  ]
}
